{
  "$schema": "./public_catalog.schema.json",
  "schemaVersion": 1,
  "showcaseBaseUrl": "https://braven-pvm.github.io/braven_charts/",
  "repositoryBaseUrl": "https://github.com/braven-pvm/braven_charts/blob/master/",
  "apiBaseUrl": "https://braven-pvm.github.io/braven_charts/api/",
  "guidesBaseUrl": "https://braven-pvm.github.io/braven_charts/guides/",
  "features": [
    {
      "id": "chart-families",
      "title": "Thirteen chart families",
      "summary": "Build Cartesian, financial, radial, and polar charts in one native renderer.",
      "page": "chart-types"
    },
    {
      "id": "interaction-selection",
      "title": "Interaction and selection",
      "summary": "Zoom, pan, track, annotate, select, and manipulate durable interval brushes.",
      "page": "selection"
    },
    {
      "id": "multi-axis-analysis",
      "title": "Multi-axis analysis",
      "summary": "Coordinate independent axes, normalized series, navigators, and summaries.",
      "page": "multi-axis"
    },
    {
      "id": "typed-authoring",
      "title": "Typed authoring and source",
      "summary": "Choose direct config, checked Grammar, fluent modifiers, or generated Dart.",
      "page": "chart-grammar"
    },
    {
      "id": "live-rendering",
      "title": "Live and efficient rendering",
      "summary": "Stream changing data through cached, frame-coalesced rendering.",
      "page": "live-stream"
    },
    {
      "id": "product-surfaces",
      "title": "Product-ready chart surfaces",
      "summary": "Add Chart, Data, Split, Source, tables, CSV, themes, and artifacts.",
      "page": "chart-workbench"
    }
  ],
  "chartFamilies": [
    {
      "id": "line",
      "label": "Line",
      "group": "Cartesian",
      "summary": "Continuous trends",
      "bestFor": "Time series, change over time, and analytical overlays",
      "page": "line-charts",
      "guideId": "line-area",
      "apiSymbols": ["LineChartSeries", "PathAnimationStyle"],
      "pairAsset": "doc/screenshots/family_line_pair.png",
      "primaryExample": {
        "title": "Line chart family",
        "alt": "Two line series showing continuous trends",
        "asset": "doc/screenshots/chart_type_line.png",
        "page": "line-charts"
      },
      "secondaryExample": {
        "title": "Synchronized route profile",
        "asset": "doc/screenshots/synchronized_route_profile.png",
        "page": "line-charts",
        "preset": "synchronized"
      }
    },
    {
      "id": "area",
      "label": "Area",
      "group": "Cartesian",
      "summary": "Magnitude and accumulation",
      "bestFor": "Volume, accumulated values, forecasts, and baseline comparison",
      "page": "area-charts",
      "guideId": "line-area",
      "apiSymbols": ["AreaChartSeries", "AreaGradient"],
      "pairAsset": "doc/screenshots/family_area_pair.png",
      "primaryExample": {
        "title": "Area chart family",
        "alt": "Layered area chart showing magnitude and accumulation",
        "asset": "doc/screenshots/chart_type_area.png",
        "page": "area-charts"
      },
      "secondaryExample": {
        "title": "Value summary composition",
        "asset": "doc/screenshots/value_summary_panel.png",
        "page": "value-summary"
      }
    },
    {
      "id": "range-area",
      "label": "Range Area",
      "group": "Cartesian",
      "summary": "Intervals and uncertainty",
      "bestFor": "Low-high envelopes, confidence bands, and bounded ranges",
      "page": "range-area-charts",
      "guideId": "range-area",
      "apiSymbols": ["RangeAreaChartSeries", "RangeAreaDataPoint"],
      "pairAsset": "doc/screenshots/family_range_area_pair.png",
      "primaryExample": {
        "title": "Range Area chart family",
        "alt": "Range Area chart showing a low-high interval band",
        "asset": "doc/screenshots/chart_type_range_area.png",
        "page": "range-area-charts"
      },
      "secondaryExample": {
        "title": "Temperature envelope",
        "asset": "doc/screenshots/range_area_temperature.png",
        "page": "range-area-charts",
        "preset": "temperature"
      }
    },
    {
      "id": "bar",
      "label": "Bar",
      "group": "Cartesian",
      "summary": "Category comparison",
      "bestFor": "Grouped, stacked, range, waterfall, and ranked data",
      "page": "bar-charts",
      "guideId": "bar",
      "apiSymbols": ["BarChartSeries", "BarChartStyle"],
      "pairAsset": "doc/screenshots/family_bar_pair.png",
      "primaryExample": {
        "title": "Bar chart family",
        "alt": "Grouped bars comparing category values",
        "asset": "doc/screenshots/chart_type_bar.png",
        "page": "bar-charts"
      },
      "secondaryExample": {
        "title": "Waterfall bridge",
        "asset": "doc/screenshots/bar_waterfall.png",
        "page": "bar-charts",
        "preset": "waterfall"
      }
    },
    {
      "id": "scatter",
      "label": "Scatter",
      "group": "Cartesian",
      "summary": "Relationships and outliers",
      "bestFor": "Correlation, cohorts, distributions, and independent encodings",
      "page": "scatter-charts",
      "guideId": "api-overview",
      "apiSymbols": ["ScatterChartSeries", "ScatterMarkerStyle"],
      "pairAsset": "doc/screenshots/family_scatter_pair.png",
      "primaryExample": {
        "title": "Scatter chart family",
        "alt": "Scatter plot showing three related observation groups",
        "asset": "doc/screenshots/chart_type_scatter.png",
        "page": "scatter-charts"
      },
      "secondaryExample": {
        "title": "Market opportunity bubbles",
        "asset": "doc/screenshots/scatter_market_opportunity.png",
        "page": "scatter-charts",
        "preset": "bubble"
      }
    },
    {
      "id": "candlestick",
      "label": "Candlestick",
      "group": "Financial",
      "summary": "Open-high-low-close movement",
      "bestFor": "Price action and interval-based financial observations",
      "page": "candlestick-charts",
      "guideId": "candlestick",
      "apiSymbols": ["CandlestickChartSeries", "CandlestickDataPoint"],
      "pairAsset": "doc/screenshots/family_candlestick_pair.png",
      "primaryExample": {
        "title": "Candlestick chart family",
        "alt": "Candlestick series with a moving-average overlay",
        "asset": "doc/screenshots/chart_type_candlestick.png",
        "page": "candlestick-charts"
      },
      "secondaryExample": {
        "title": "Market structure",
        "asset": "doc/screenshots/candlestick_market_structure.png",
        "page": "candlestick-charts"
      }
    },
    {
      "id": "heatmap",
      "label": "Heatmap",
      "group": "Cartesian",
      "summary": "Measured values across a matrix",
      "bestFor": "Activity patterns, calendars, correlation matrices, and dense measured fields",
      "page": "heatmap-charts",
      "guideId": "heatmap",
      "apiSymbols": ["HeatmapChartSeries", "HeatmapDataPoint", "HeatmapColorScale"],
      "pairAsset": "doc/screenshots/family_heatmap_pair.png",
      "primaryExample": {
        "title": "Heatmap chart family",
        "alt": "Diverging Heatmap showing measured activity across a matrix",
        "asset": "doc/screenshots/chart_type_heatmap.png",
        "page": "heatmap-charts"
      },
      "secondaryExample": {
        "title": "Calendar temperature matrix",
        "asset": "doc/screenshots/heatmap_calendar.png",
        "page": "heatmap-charts",
        "preset": "calendar"
      }
    },
    {
      "id": "pie",
      "label": "Pie",
      "group": "Partition radial",
      "summary": "Contribution to one whole",
      "bestFor": "Small categorical share datasets with one total",
      "page": "pie-charts",
      "guideId": "pie",
      "apiSymbols": ["PieChartSeries", "PieChartStyle"],
      "pairAsset": "doc/screenshots/family_pie_pair.png",
      "primaryExample": {
        "title": "Pie chart family",
        "alt": "Pie chart showing category contribution to one whole",
        "asset": "doc/screenshots/chart_type_pie.png",
        "page": "pie-charts"
      },
      "secondaryExample": {
        "title": "Revenue contribution",
        "asset": "doc/screenshots/pie_revenue_contribution.png",
        "page": "pie-charts"
      }
    },
    {
      "id": "donut",
      "label": "Donut",
      "group": "Partition radial",
      "summary": "Contribution with center context",
      "bestFor": "Part-to-whole data that benefits from a central value",
      "page": "donut-charts",
      "guideId": "donut",
      "apiSymbols": ["DonutChartSeries", "DonutCenterContent"],
      "pairAsset": "doc/screenshots/family_donut_pair.png",
      "primaryExample": {
        "title": "Donut chart family",
        "alt": "Donut chart with a central total",
        "asset": "doc/screenshots/chart_type_donut.png",
        "page": "donut-charts"
      },
      "secondaryExample": {
        "title": "Campaign reach",
        "asset": "doc/screenshots/donut_campaign_reach.png",
        "page": "donut-charts"
      }
    },
    {
      "id": "concentric-donut",
      "label": "Concentric Donut",
      "group": "Partition radial",
      "summary": "Independent totals, shared view",
      "bestFor": "Comparing distributions across periods, cohorts, or groups",
      "page": "concentric-donut",
      "guideId": "concentric-donut",
      "apiSymbols": ["ConcentricDonutConfig", "DonutChartSeries"],
      "pairAsset": "doc/screenshots/family_concentric_donut_pair.png",
      "primaryExample": {
        "title": "Concentric Donut chart family",
        "alt": "Three concentric donut rings with independent totals",
        "asset": "doc/screenshots/chart_type_concentric.png",
        "page": "concentric-donut"
      },
      "secondaryExample": {
        "title": "Service-level health",
        "asset": "doc/screenshots/concentric_service_health.png",
        "page": "concentric-donut"
      }
    },
    {
      "id": "polar-column",